Purchase Price,SKU,Image,Manufacturer,URL,Sale Price,Price,Description,Markup,Item Type,Item Name
199,1001263564,https://images.thdstatic.com/productImages/e11e9645-0fe0-4aa7-aace-7a92160b27a1/svn/white-niagara-stealth-two-piece-toilets-77000whai1-n7714-n7717-64_1000.jpg,Niagara Stealth,https://www.homedepot.com/p/Niagara-Stealth-Stealth-2-Piece-0-8-GPF-Ultra-High-Efficiency-Single-Flush-Elongated-Toilet-in-White-Seat-Included-77000WHAI1-N7714-N7717/205611735,199,199,"This 2-piece 0.8 GPF Ultra-High-Efficiency Single Flush Elongated Toilet featuring Stealth Technology in White from Niagara is the world's first ultra-high-efficiency toilet. Powering the toilet is Stealth, patented vacuum-assist technology from Niagara, which uses only 0.8 GPF (3 LPF) while still providing a powerful flush that thoroughly evacuates the bowl every time, no need to double flush. The flapper-less design eliminates chains and levers, making maintenance and leaks a thing of the past. Also, this toilet virtually eliminates all refill noise as the fill valve is never exposed. Niagara toilets deliver a quiet, powerful and proven flush, saving thousands of gallons of water with no change in consumer use or behavior.",43%,Cost of Goods Sold,"Niagara Stealth Stealth 2-Piece 0.8 GPF Ultra-High-Efficiency Single Flush Elongated Toilet in White, Seat Included"
249,1007185083,https://images.thdstatic.com/productImages/a94aa05f-3d53-45ac-8479-927ba06444c5/svn/glossy-white-swiss-madison-one-piece-toilets-sm-1t254-64_1000.jpg,Swiss Madison,https://www.homedepot.com/p/Swiss-Madison-St-Tropez-1-Piece-1-1-1-6-GPF-Dual-Flush-Elongated-Toilet-in-Glossy-White-SM-1T254/303338365,249,249,"The St. Tropez One-Piece Elongated Toilet offers a seamless design with a fully skirted bowl creating a modern design for any bathroom. The dual-flush function offers the ability to conserve water without compromising performance. Its dual-flush function conserves water without compromising on power, while our Vortex flush technology uses powerful dual nozzles to keep your bowl cleaner than standard rim holes.",43%,Cost of Goods Sold,Swiss Madison St. Tropez 1-Piece 1.1/1.6 GPF Dual Flush Elongated Toilet in Glossy White
169,1012554129,https://images.thdstatic.com/productImages/82ca819a-dd7a-4b3d-aa9b-74f2261cd4e5/svn/white-glacier-bay-two-piece-toilets-n2455e-64_1000.jpg,Glacier Bay,https://www.homedepot.com/p/Glacier-Bay-Power-Flush-12-in-Rough-in-2-Piece-0-95-GPF-1-28-GPF-Dual-Flush-Elongated-Toilet-in-White-with-Slow-Close-Seat-Included-N2455E/332209561,169,169,"Replace your old toilet with the Power Flush 2-piece 0.95 GPF / 1.28 GPF high-efficiency dual flush elongated toilet featuring Niagara Stealth Technology in white. This toilet features patented hydraulic technology, known as the Stealth. 1 flush thoroughly evacuates the bowl every time and eliminates double flushing. This toilet has achieved a quiet, powerful and proven flush, saving thousands of gallons with no change in consumer use or behavior. The flapper-less design means no costly flapper, chains or levers to replace and no leaks ever. Also, this toilet virtually eliminates all refill noise as the fill valve is never exposed. Quiet, slow-close seat included.",43%,Cost of Goods Sold,Glacier Bay Power Flush 12 in. Rough in 2-Piece 0.95 GPF/1.28 GPF Dual Flush Elongated Toilet in White with Slow-Close Seat Included
259,1005838926,https://images.thdstatic.com/productImages/56d2682e-dd21-493f-b95a-05e4997b8826/svn/white-kohler-two-piece-toilets-31668-0-64_1000.jpg,KOHLER,https://www.homedepot.com/p/KOHLER-Cimarron-12-in-Rough-In-2-Piece-1-28-GFP-Single-Flush-Round-Toilet-in-White-with-Soft-Close-Seat-31668-0/314689625,259,259,"The Cimarron Comfort Height toilet has become an enduring symbol of power and timeless beauty. Trusted for years by professionals and homeowners, Cimarron features KOHLER's most complete flush ever, Revolution 360° swirl flush powered by the AquaPiston flush valve. Revolution 360° swirl flushing technology keeps your bowl cleaner longer than a conventional flush. Installation saves you time and money, too, with KOHLER's patent-pending two-bolt tank-to-bowl omni-directional leveling system.",43%,Cost of Goods Sold,KOHLER Cimarron 12 in. Rough In 2-Piece 1.28 GFP Single Flush Round Toilet in White with Soft Close Seat
169,1011860996,https://images.thdstatic.com/productImages/696c012d-0937-4ed8-ab90-8c5ff0bc7b37/svn/white-american-standard-two-piece-toilets-726aa101-020-64_1000.jpg,American Standard,https://www.homedepot.com/p/American-Standard-Reliant-12-in-Rough-In-2-Piece-1-28-GPF-Single-Flush-Elongated-Toilet-with-Slow-Close-Seat-in-White-726AA101-020/330819690,169,169,"The Reliant Two-Piece Chair-Height Elongated Toilet from American Standard offers the worry-free reliability you expect from one of the industry's most trusted names for more than 140 years. This low-consumption toilet uses 20% less water than a regular toilet and is WaterSense certified for high efficiency. The Reliant toilet is easy to install and features the easy-access comfort of a 16 ½-in. chair height and elongated front. Backed by an industry-leading warranty that includes lifetime on chinaware plus 2 years on mechanical parts, twice the industry standard of one year, you can be confident Reliant will stand the test of time.",43%,Cost of Goods Sold,American Standard Reliant 12 in. Rough In 2-Piece 1.28 GPF Single Flush Elongated Toilet with Slow Close Seat in White
475.11,1001691388,https://images.thdstatic.com/productImages/31e7b07a-a21d-4186-ba32-6894417b19fe/svn/cotton-white-toto-one-piece-toilets-ms854114e-01-64_1000.jpg,TOTO,https://www.homedepot.com/p/TOTO-Eco-UltraMax-12-in-Rough-In-One-Piece-1-28-GPF-Single-Flush-Elongated-Toilet-in-Cotton-White-SoftClose-Seat-Included-MS854114E-01/206794401,475.11,475.11,"The TOTO Eco UltraMax One-Piece Elongated 1.28 GPF Toilet projects TOTO's mark of excellence: ""People Planet Water."" The TOTO Eco UltraMax features a sleek, one-piece design that will immediately beautify the appearance of your bathroom. The one-piece design is not only aesthetically pleasing, but also offers the benefit of being easier to clean versus a two-piece toilet. By removing the gap between the tank and bowl, we eliminate the hiding place for dirt and debris. An additional benefit of the one-piece toilet is that there is no threat of leaks from bolts or gaskets that can occur in two-piece toilets. The TOTO Eco UltraMax utilizes TOTO's E-Max flushing system. The E-Max flushing system features a 3 in. wide flush valve, extra-large siphon jet, and a large trapway. This reliable, highly efficient combination generates a powerful cleansing flush while only using 1.28 Gal. of water. The TOTO Eco UltraMax 1.28 GPF meets the standards for EPA WaterSense, and California's CEC and CALGreen requirements. The TOTO Eco UltraMax has a left-hand chrome trip lever and has an included TOTO SoftClose seat.",43%,Cost of Goods Sold,"TOTO Eco UltraMax 12 in. Rough In One-Piece 1.28 GPF Single Flush Elongated Toilet in Cotton White, SoftClose Seat Included"
8.98,147966,https://images.thdstatic.com/productImages/83cbd585-c033-4c6c-8bfd-4895635b56b3/svn/fluidmaster-toilet-fill-valves-400arp25-64_1000.jpg,Fluidmaster,https://www.homedepot.com/p/Fluidmaster-400A-Universal-Toilet-Fill-Valve-400ARP25/100554467,8.98,8.98,"The Fluidmaster 400A Universal Toilet Fill Valve is the #1 selling toilet fill valve in the world. A height adjustable toilet replacement part designed to fix leaking, noisy and slow filling toilet valves, in an easy to install model. The anti-siphon design eliminates fresh water supply contamination, is code approved and efficiently uses water. The 400A is a trusted and durable toilet replacement part, consisting of corrosion-resistant materials combined with simple installation. Fluidmaster is the trusted brand for replacement fill valves and all your toilet parts needs. Parts included with 400A purchase are Fill Valve, Shank Washer, Locknut, Refill Tube, Refill Clip and Instructions. Upgrade your toilets fill performance with this proven toilet tank fill valve. The Fluidmaster 400A is a quick and easy replacement toilet fill valve that solves common toilet problems.",43%,Cost of Goods Sold,Fluidmaster 400A Universal Toilet Fill Valve
17.48,1001759758,https://images.thdstatic.com/productImages/826267cc-2490-4549-a735-18970cc8d8f9/svn/fluidmaster-toilet-repair-kits-k-400h-039-t14-64_1000.jpg,Fluidmaster,https://www.homedepot.com/p/Fluidmaster-PerforMAX-Universal-High-Performance-Toilet-Fill-Valve-and-2-in-Flapper-Repair-Kit-K-400H-039-T14/321321170,17.48,17.48,"The Fluidmaster K-400H-039-T14 Toilet Fill Valve and Flapper Repair Kit is the number on solution for common toilet problems. The PerforMAX Toilet Fill Valve offers the quietest and most powerful solution to enhance you're toilet's fill performance. While the PerforMAX 2 in. Toilet Flapper features an adjustable design to save on water use per flush. This easy to install design is universal, fitting most toilet brands and models. The universal toilet fill valve easily adjusts between 10 in. 15 in. to fit more tanks. The 2 in. adjustable toilet flapper features a solid frame for a proper seal with every flush. High quality, durable toilet replacement parts in this kit, featuring built in Microban, corrosion resistant materials and a 7-year warranty. The PerforMAX Toilet Fill Valve and 2 in. Flapper Repair Kit, The top choice to maximize performance and save water.",43%,Cost of Goods Sold,Fluidmaster PerforMAX Universal High Performance Toilet Fill Valve and 2 in. Flapper Repair Kit
219,1011059351,https://images.thdstatic.com/productImages/b757dc05-e5ea-464c-a733-601628b9f363/svn/white-american-standard-two-piece-toilets-788ab104-020-64_1000.jpg,American Standard,https://www.homedepot.com/p/American-Standard-Cadet-10-in-Antimicrobial-2-Piece-1-28-GPF-Single-Flush-Chair-Height-Round-Front-Toilet-with-Slow-Close-Seat-in-White-788AB104-020/329008713,219,219,"The Cadet Chair Height Elongated Toilet from American Standard is a high-efficiency, ultra-low consumption toilet that uses 20% less water than conventional toilets without sacrificing performance. Combining power and convenience, this Cadet has a 10 in. rough-in and stands at a comfortable height for ease of use. Features exclusive EverClean antimicrobial surface on the toilet and seat, and PowerWash rim for a longer-lasting clean.",43%,Cost of Goods Sold,American Standard Cadet 10 in. Antimicrobial 2-Piece 1.28 GPF Single Flush Chair Height Round Front Toilet with Slow Close Seat in White
6.97,405140,https://images.thdstatic.com/productImages/a153a3ed-a8bf-4339-ab85-819e2345f4e5/svn/silver-braided-polymer-brasscraft-supply-lines-b1-16a-f-64_1000.jpg,BrassCraft,https://www.homedepot.com/p/BrassCraft-3-8-in-Compression-x-1-2-in-FIP-x-16-in-Braided-Polymer-Faucet-Supply-Line-B1-16A-F/100056596,6.97,6.97,"BrassCraft Speedi Plumb Plus 3/8 in. Compression inlet x 1/2 in. Female Iron Pipe outlet x 16 in. of length flexible braided polymer water connector is corrosion resistant inside and out. Used to connect the water supply to your faucet, this connector features a high tenacity, multi-filament yarn, protected by a special polymer coating for optimum corrosion resistance and durability. On the inside, our tough PVC tubing resists attack by chlorine, chloramines and other corrosive elements. The braided polymer fibers are designed to bend freely without kinking or crimping. Use to hookup cold or hot water supply.",43%,Cost of Goods Sold,BrassCraft 3/8 in. Compression x 1/2 in. FIP x 16 in. Braided Polymer Faucet Supply Line
216,1010057398,https://images.thdstatic.com/productImages/b5577681-c5ba-4cb0-9626-49c4af0d907d/svn/white-hanikes-one-piece-toilets-ar03n-64_1000.jpg,Hanikes,https://www.homedepot.com/p/Hanikes-One-Piece-1-1-1-6-GPF-Dual-Flush-Round-Toilet-in-White-Soft-Close-Seat-Included-AR03N/326349785,216,216,"Give your bathroom an upgrade with this Hanikes One-Piece Toilet. The seat lid can be closed silently while conserving space with a compact round bowl. Featuring a concealed and smooth skirt design, it is not only visually appealing but also easy to clean. The powerful dual flush is extremely reliable and provides performance that never fails. The front bowl sits at a convenient height for ease of use and is the perfect design for any modern home.",43%,Cost of Goods Sold,Hanikes One-Piece 1.1/1.6 GPF Dual Flush Round Toilet in White Soft Close Seat Included
1145,1010438319,https://images.thdstatic.com/productImages/84446a55-03c0-45cc-8cd3-3bf2943954eb/svn/cotton-white-toto-bidet-toilet-seats-sw4736at40-01-64_1000.jpg,TOTO,https://www.homedepot.com/p/TOTO-S7A-Washlet-Elongated-Electric-Heated-Bidet-Seat-with-Contemporary-Lid-in-Cotton-White-SW4736AT40-01/327216025,1145,1145,"TOTO S7A elongated bidet toilet seat with ewater+ and auto open and close contemporary lid is an electronic luxury seat that cleanses you with endless warm water, providing an exceptionally clean feeling. Instead of traditional toilet paper that can sometimes be rough and often ineffective, the washlet quickly provides comfortable warm water cleansing at the touch of a button. The washlet features TOTO's technologically advanced ewater+ system that mists the wand and toilet bowl, reducing the need for harsh cleaning chemicals. Premist wets the surface of the toilet bowl, aiding in the removal of waste and resulting in a better clean. No need to touch buttons or handles, and never worry about someone forgetting to flush. Washlet S7A is operated by a luxury style illuminated touch button remote with 4-user memory to save preferred settings. The washlet features 5-spray settings, auto open and close lid, heated seat, a nightlight, and instantaneous water heating. The newly redesigned lid style resides flush with the toilet bowl, providing a streamline look and giving the impression of an integrated system. The washlet reduces the need for toilet paper, saving trees and water used to manufacture each roll. Medical conditions, age, and debilitating illnesses can make using the bathroom without assistance almost impossible; but with a washlet, just the touch of a button can leave you feeling clean. Includes mounting and connection hardware.",43%,Cost of Goods Sold,TOTO S7A Washlet Elongated Electric Heated Bidet Seat with Contemporary Lid in Cotton White
6.97,1000011539,https://images.thdstatic.com/productImages/75c9665a-bd53-4c60-ad18-972cf783c2db/svn/silver-braided-polymer-brasscraft-supply-lines-b1-16dl-f-64_1000.jpg,BrassCraft,https://www.homedepot.com/p/BrassCraft-3-8-in-Compression-x-7-8-in-Ballcock-Nut-x-16-in-Braided-Polymer-Toilet-Supply-Line-B1-16DL-F/203139191,6.97,6.97,"BrassCraft Speedi Plumb Plus 3/8 in. compression inlet x 7/8 in. ballcock Nut outlet x 16 in. of length flexible braided polymer water connector is corrosion resistant inside and out. Used to connect the water supply to your toilet, this connector features a high tenacity, multi-filament yarn, protected by a special polymer coating for optimum corrosion resistance and durability. On the inside, our tough PVC tubing resists attack by chlorine, chloramines and other corrosive elements. The braided polymer fibers are designed to bend freely without kinking or crimping. Connection to toilet features hand-tighten wing-nut for quick and easy installation.",43%,Cost of Goods Sold,BrassCraft 3/8 in. Compression x 7/8 in. Ballcock Nut x 16 in. Braided Polymer Toilet Supply Line
280,1011952545,https://images.thdstatic.com/productImages/2e3f676f-2724-45ae-9d08-9f9bc5c2b5bb/svn/white-two-piece-toilets-hd-us-ht-140-06-64_1000.jpg,,https://www.homedepot.com/p/Tall-Toilets-for-Seniors-21-in-2-Piece-1-28-GPF-Single-Flush-Elongated-Raised-Toilet-in-White-Soft-Close-Seat-Included-HD-US-HT-140-06/330813606,280,280,"The main function of the 21 in. H toilet is to provide a more comfortable sitting posture, making using the toilet easier and more convenient. This kind of modern toilet design is usually suitable for the elderly, people with physical disabilities or taller people, because regular height toilets are not comfortable or convenient enough to use. In addition, high toilets can also help reduce knee and joint pressure when squatting, which may be more popular for people recovering from joint diseases or sports injuries.",43%,Cost of Goods Sold,"Tall Toilets for Seniors 21 in 2-Piece 1.28 GPF Single Flush Elongated Raised Toilet in White, Soft Close Seat Included"
10.98,235674,https://images.thdstatic.com/productImages/d2bcdf7d-652e-4ee8-9575-8c986eaca026/svn/chrome-brasscraft-shut-off-valves-ocr19x-c1-64_1000.jpg,BrassCraft,https://www.homedepot.com/p/BrassCraft-1-2-in-Nominal-Compression-Inlet-x-3-8-in-O-D-Compression-Outlet-Multi-Turn-Chrome-Plated-Angle-Valve-OCR19X-C1/202047058,10.98,10.98,"BrassCraft 1/2 in. Nominal Compression Inlet x 3/8 in. O.D. Compression Outlet Multi-Turn Angle Valve controls water flow to household plumbing fixtures - faucets, toilets, dishwashers, icemakers, washing machines, etc. The straight valve is most often used where the water pipe enters the room from the floor. With a few turns of the valve handle, you are able to stop the flow of water leading to the plumbing fixture, allowing for maintenance and repair without turning off water to the entire home.",43%,Cost of Goods Sold,BrassCraft 1/2 in. Nominal Compression Inlet x 3/8 in. O.D. Compression Outlet Multi-Turn Chrome Plated Angle Valve
789,1004956843,https://images.thdstatic.com/productImages/bd80dfd6-9f44-46bb-8eb2-e6fe2656ca42/svn/kohler-alcove-shower-doors-k-r706851-8l-bnk-64_1000.jpg,KOHLER,https://www.homedepot.com/p/KOHLER-Elmbrook-55-60-in-W-x-74-in-H-Sliding-Frameless-Shower-Door-in-Anodized-Brushed-Nickel-with-Crystal-Clear-Glass-K-R706851-8L-BNK/311958510,789,789,"Bringing new technology and sleek style to the contemporary bathroom space, Elmbrook shower doors feature an innovative bypass system and roller design that provide an amazingly smooth, quiet sliding action for a difference you can feel. Elmbrook's unique design, including fully bypassable glass panels, makes installation easier than ever and allows for adjustability while the door is hanging. Distinguished vertical handles complement Elmbrook's modern minimalist look, creating an open, inviting space for showering.",43%,Cost of Goods Sold,KOHLER Elmbrook 55-60 in. W x 74 in. H Sliding Frameless Shower Door in Anodized Brushed Nickel with Crystal-Clear Glass
199,1012077407,https://images.thdstatic.com/productImages/2d4f2299-cf2b-420f-9dae-6d9aba1bacc8/svn/white-kohler-two-piece-toilets-35730-0-64_1000.jpg,KOHLER,https://www.homedepot.com/p/KOHLER-Joist-2-Piece-Complete-Solution-1-28-GPF-Single-Flush-Elongated-Toilet-in-White-Seat-Included-35730-0/331238033,199,199,"The Joist toilet embodies a simple and approachable style. The modern transitional design complements most bathroom decors. This Joist The Complete Solution toilet features KOHLERs most complete flush ever, powered by the Aqua Piston flush valve. The 2-piece elongated toilet design provides additional room and comfort and comes complete with a Quiet-Close toilet seat.",43%,Cost of Goods Sold,KOHLER Joist 2-Piece Complete Solution 1.28 GPF Single Flush Elongated Toilet in White (Seat Included)
34.98,1004392394,https://images.thdstatic.com/productImages/213e6398-22a4-4b49-b5bf-72a2e3317ff4/svn/white-kohler-toilet-seats-k-22203-0-64_1000.jpg,KOHLER,https://www.homedepot.com/p/KOHLER-Highline-Elongated-Grip-Tight-Bumpers-Soft-Close-Front-Toilet-Seat-in-White-K-22203-0/309644767,34.98,34.98,"Engineered to fit 1- and 2-piece round-front toilets, this Highline plastic seat features a single-hinge design that makes for easier cleaning. Innovative Quiet-Close technology prevents noisy slamming. Unique Grip-Tight bumpers hold the seat firmly in place and prevent shifting.",43%,Cost of Goods Sold,"KOHLER Highline Elongated Grip Tight Bumpers, Soft Close Front Toilet Seat in White"
14.98,1003409769,https://images.thdstatic.com/productImages/e19cb71f-27c1-48fb-890b-56e918915cb8/svn/fluidmaster-toilet-fill-valves-400h-002-p10-64_1000.jpg,Fluidmaster,https://www.homedepot.com/p/Fluidmaster-PerforMAX-Universal-High-Performance-Toilet-Fill-Valve-400H-002-P10/305719514,14.98,14.98,"The Fluidmaster 400H-002 PerforMAX High Performance Universal Toilet Fill Valve offers the best in toilet fill valve replacement. This fill valve sets the performance standard and features new upgrades for even more water-savings, and faster installation. The most powerful fill valve in the market, generating 2X greater refill rates than standard designs, with ultra-quiet operation. Installation is simple, with a pre-installed shank washer, and new step-by-step pamphlet instructions for the fastest and easiest repair possible. A universal toilet fill valve this design fits most brands. Featuring EZ-twist shank height adjustment from 9 in. to 14 in. to fit more tanks. Best for use in 1.28 HET and 1.6 GPF toilets, but can also be used with pre-1994 3.5 GPF toilets. Designed to save-water with adjustable tank water level, and bowl water level dials that are easy to use. Customize your water use per flush depending on your needs, or toilet model. The PerforMAX Fill Valve is a code approved, anti-siphon design that won't contaminate the fresh water supply. Including a fill valve, washer, locknut, tube and clip for everything needed to replace your toilet fill valve. Save-water and get the best performing toilet fill valve available with Fluidmaster's 400H-002 PerforMAX Toilet Fill Valve.",43%,Cost of Goods Sold,Fluidmaster PerforMAX Universal High Performance Toilet Fill Valve
34.87,1004368206,https://images.thdstatic.com/productImages/9ec6d68e-aa51-4f01-b566-1ae0852aaaae/svn/chrome-plated-brass-brasscraft-shut-off-valves-g2cr19x-cm5-64_1000.jpg,BrassCraft,https://www.homedepot.com/p/BrassCraft-1-2-in-Comp-Inlet-x-3-8-in-Comp-Outlet-1-4-Turn-Angle-Valve-5-pack-G2CR19X-CM5/309283969,34.87,34.87,"BrassCraft 1/2 in. Nom Compression Inlet x 3/8 in. OD Compression Outlet 1/4-Turn Angle Valve controls water flow to household plumbing fixtures - faucets, toilets, dishwashers, icemakers, washing machines, etc. The angle valve is most often used where the water pipe enters the room from the wall. With a 90° turn of the valve handle, you are able to stop the flow of water leading to the plumbing fixture, allowing for maintenance and repair without shutting off the water to the entire home.",43%,Cost of Goods Sold,BrassCraft 1/2 in. Comp Inlet x 3/8 in. Comp Outlet 1/4-Turn Angle Valve (5-pack)
866.54,1004763545,https://images.thdstatic.com/productImages/d544e9c7-8e89-4213-a1ec-3a55df6648e5/svn/cotton-white-toto-one-piece-toilets-ms642124cefg-01-64_1000.jpg,TOTO,https://www.homedepot.com/p/TOTO-Nexus-12-in-Rough-In-One-Piece-1-28-GPF-Single-Flush-Elongated-Toilet-with-CEFIONTECT-in-Cotton-White-Seat-Included-MS642124CEFG-01/311444875,866.54,866.54,"The TOTO Nexus 1-Piece Elongated 1.28 GPF Universal Height Skirted Toilet with CEFIONTECT has a sleek and clean high-profile design, upholding TOTOs vision to create a culture of comfortable, healthy living. The TOTO Nexus features a modern, 1-Piece design that will instantly elevate any bathroom decor. The 1-Piece design is not only aesthetically pleasing, but also offers the benefit of being easier to clean versus a 2-Piece toilet. By removing the gap between the tank and bowl, dirt and debris have no place to hide. An additional benefit of the 1-Piece toilet is that there is no threat of leaks from bolts or gaskets that can occur in 2-Piece toilets. Skirted Design toilets eliminate the need to reach behind the bowl to clean the nooks and crannies of the exterior trapway. The TOTO Nexus features TOTOs TORNADO FLUSH, a hole-free rim design with dual-nozzles that creates a centrifugal washing action that assists in rinsing the bowl more efficiently. This version of the TOTO Nexus includes CEFIONTECT, a layer of exceptionally smooth glaze that prevents particles from adhering to the ceramic. This feature, coupled with TORNADO FLUSH, assists to reduce the frequency of toilet cleanings, minimizing the usage of water, harsh chemicals and time required for cleaning. This 1-Piece toilet is designed in TOTOs Universal Height, which allows for a more comfortable seat position across a wide range of users.",43%,Cost of Goods Sold,"TOTO Nexus 12 in. Rough In One-Piece 1.28 GPF Single Flush Elongated Toilet with CEFIONTECT in Cotton White, Seat Included"
211.09,1008319705,https://images.thdstatic.com/productImages/989ced26-a2b2-4fef-bf02-3ffa5d07862c/svn/white-deervalley-one-piece-toilets-dv-1f52812-64_1000.jpg,DEERVALLEY,https://www.homedepot.com/p/DEERVALLEY-Liberty-12-in-Rough-In-1-Piece-1-1-1-6-GPF-Dual-Flush-Compact-Round-Toilet-in-White-Soft-Close-Seat-Included-DV-1F52812/321392521,211.09,211.09,"Modern and compact design. Although designed for very small spaces, this toilet looks perfect in every modern bathroom. The seat lid can be closed silently. Featuring a concealed and smooth skirt design, it is not only visually appealing but also easy to clean. The powerful dual flush is extremely reliable and provides performance that never fails.",43%,Cost of Goods Sold,DEERVALLEY Liberty 12 in. Rough In 1-Piece 1.1/1.6 GPF Dual Flush Compact Round Toilet in White Soft Close Seat Included
