Purchase Price,SKU,Image,Manufacturer,URL,Sale Price,Price,Description,Markup,Item Type,Item Name
179,1006587338,https://images.thdstatic.com/productImages/45d0bddb-734c-4909-87bc-4f5b99e1bc3e/svn/white-glacier-bay-one-piece-toilets-n2420-64_1000.jpg,Glacier Bay,https://www.homedepot.com/p/Glacier-Bay-McClure-12-inch-Rough-In-One-Piece-1-1-GPF-1-6-GPF-Dual-Flush-Elongated-Toilet-in-White-Seat-Included-N2420/317676800,179,179,"This white one-piece toilet by Glacier Bay occupies minimal space while offering the spaciousness of an elongated bowl. This high-efficiency unit delivers 1.1 GPF for liquid flushes and 1.6 for full flushes, both options easily located at the top-mounted push button. This toilet features integrated tank-to-bowl construction for easy cleaning and its soft lines and sleek curves create an elegant design. While conserving water so you can save on your utility bills, this vitreous china-construction toilet is crack-resistant and includes all necessary installation hardware and a slow-close seat.",43%,Cost of Goods Sold,Glacier Bay McClure 12 inch Rough In One-Piece 1.1 GPF/1.6 GPF Dual Flush Elongated Toilet in White Seat Included
439,1004869199,https://images.thdstatic.com/productImages/b208fca1-97ef-4ef4-ae6a-a712867c7398/svn/white-kohler-alcove-bathtubs-k-r23217-la-0-64_1000.jpg,KOHLER,https://www.homedepot.com/p/KOHLER-Elmbrook-60-in-x-30-25-in-Soaking-Bathtub-with-Left-Hand-Drain-in-White-K-R23217-LA-0/311699619,439,439,"The Elmbrook 60 in. alcove bath is a simple, versatile design with timeless style. Defined by sleek lines and an integral apron, this easy-to-clean bath offers a polished look that complements traditional or contemporary bathroom decor. It comes with a lifetime limited warranty.",43%,Cost of Goods Sold,KOHLER Elmbrook 60 in. x 30.25 in. Soaking Bathtub with Left-Hand Drain in White
10.98,256508,https://images.thdstatic.com/productImages/4b5aee92-f52c-4d83-87ec-fe4102637f37/svn/zep-grout-tile-cleaners-zu104632-64_1000.jpg,ZEP,https://www.homedepot.com/p/ZEP-32-fl-oz-Grout-Cleaner-and-Brightener-ZU104632/100619266,10.98,10.98,"Deep cleaning grout is a tough job, even for Pros. Zep 32 oz. Grout Cleaner and Brightener contains strong but safe acids that act as a stain remover for grout lines. This professional strength formula quickly restores stained grout lines on tile floors without the need for heavy scrubbing. The formula is not abrasive to tile surfaces.",43%,Cost of Goods Sold,ZEP 32 fl. oz. Grout Cleaner and Brightener
699,1009818314,https://images.thdstatic.com/productImages/f58c6853-8412-4b68-81b7-c8bb99dbed05/svn/gray-horow-bidet-toilets-t03-64_1000.jpg,HOROW,https://www.homedepot.com/p/HOROW-Tankless-Elongated-Smart-Toilet-Bidet-in-White-with-Auto-Flush-Heated-Seat-Warm-Air-Dryer-Bubble-Infusion-Wash-T03/325175066,699,699,"The HOROW Smart Toilet Bidet System gives your bathroom an upgrade that's easy to install. It features auto flush, a heated seat, an air dryer, massage washing, auto wash and antibiosis nozzle, night light and 6 level safety protection. This luxurious bidet system is designed with a wireless remote so you can change the settings exactly to your liking.",43%,Cost of Goods Sold,"HOROW Tankless Elongated Smart Toilet Bidet in White with Auto Flush, Heated Seat, Warm Air Dryer, Bubble Infusion Wash"
134,1007773039,https://images.thdstatic.com/productImages/c833b45a-96e6-49f0-a295-3abeaaadf1f8/svn/white-panasonic-bath-fans-rg-c811a-64_1000.jpg,Panasonic,https://www.homedepot.com/p/Panasonic-Whisper-Choice-DC-Pick-A-Flow-80-110-CFM-Ceiling-Bathroom-Exhaust-Fan-with-Flex-Z-Fast-Bracket-RG-C811A/320520625,134,134,"The Whisper Choice DC exhaust fan with Pick-A-Flow CFM allows you to choose your airflow, 80 or 110 CFM. Simplify the selection process and ensure optimum CFM performance while eliminating humidity, mold, mildew, and other air pollutants from the bathroom and increasing your air quality. The DC-ECM Motor technology offers reduced energy costs, long life and is environmentally friendly. In addition to bathrooms, this fan is your ventilation solution for medium-to-large sized rooms - laundry room, sunroom, basement, or garage.",43%,Cost of Goods Sold,Panasonic Whisper Choice DC Pick-A-Flow 80/110 CFM Ceiling Bathroom Exhaust Fan with Flex-Z Fast Bracket
249,1003951328,https://images.thdstatic.com/productImages/17405bb9-57a1-4a57-a9ec-82b7f7a493a3/svn/Kohler-Highline-Arc-The-Complete-Solution-2-Piece-Elongated-Toilet-Front_1000.jpg,KOHLER,https://www.homedepot.com/p/KOHLER-Highline-Arc-12-in-Rough-In-2-Piece-1-28-GFP-Single-Flush-Elongated-Chair-Height-Toilet-in-White-with-Soft-Close-Seat-K-78279-0/307908571,249,249,"Trusted for years by professionals, Highline toilets are KOHLER's bestselling toilet family. A brilliant blend of style and water efficiency, this Highline Arc toilet is distinguished by an elegant flared tank. Coupled with KOHLER's powerful canister flush valve, there's no sacrificing performance for design. An innovative 1.28 Gal. flush setting provides significant water savings of up to 16,500 Gal. per year, compared to an old 3.5 Gal. toilet. This Complete Solution package includes everything necessary for installation and is available exclusively at The Home Depot.",43%,Cost of Goods Sold,KOHLER Highline Arc 12 in. Rough In 2-Piece 1.28 GFP Single Flush Elongated Chair Height Toilet in White with Soft Close Seat
129,1004159514,https://images.thdstatic.com/productImages/c6b881cc-9ac4-4ba6-86c9-f767952a53db/svn/white-glacier-bay-two-piece-toilets-n2450e-64_1000.jpg,Glacier Bay,https://www.homedepot.com/p/Glacier-Bay-Power-Flush-12-inch-Rough-In-Two-Piece-1-28-GPF-Single-Flush-Elongated-Toilet-in-White-Seat-Included-N2450E/308702440,129,129,"Replace your old toilet with the Power Flush 2-piece 1.28 GPF High-Efficiency Single Flush Elongated Toilet Featuring Niagara Stealth Technology in White. This toilet features patented hydraulic technology, known as the Stealth. One flush thoroughly evacuates the bowl every time and eliminates double flushing. This toilet has achieved a quiet, powerful and proven flush saving thousands of gallons with no change in consumer use or behavior. The flapper less design means no costly flapper, chains or levers to replace and no leaks ever. Also, this toilet virtually eliminates all refill noise as the fill valve is never exposed.",43%,Cost of Goods Sold,Glacier Bay Power Flush 12 inch Rough In Two-Piece 1.28 GPF Single Flush Elongated Toilet in White Seat Included
279,1005261406,https://images.thdstatic.com/productImages/29cf7f8d-d1b8-40ec-bf6c-69da53b99536/svn/white-kohler-two-piece-toilets-k-31674-0-64_1000.jpg,KOHLER,https://www.homedepot.com/p/KOHLER-Gleam-12-in-Rough-In-2-Piece-1-28-GFP-Single-Flush-Elongated-Chair-Height-Toilet-in-White-with-Soft-Close-Seat-K-31674-0/312838678,279,279,"This WaterSense-labeled high-efficiency toilet delivers water conservation and easy installation in a sleek, skirted design. The Gleam two-piece skirted toilet utilizes Kohler's patented new ReadyLock installation system for easier, more intuitive installation. The skirted trapway installs to the floor flange and attaches to the toilet, eliminating the need to drill holes for a standard 12"" rough-in while still offering the same secure installation as non-skirted toilets.",43%,Cost of Goods Sold,KOHLER Gleam 12 in. Rough In 2-Piece 1.28 GFP Single Flush Elongated Chair Height Toilet in White with Soft Close Seat
239,1004303353,https://images.thdstatic.com/productImages/08bc4c0a-fd46-4a18-9931-cd4dd4f8fc15/svn/white-bio-bidet-bidet-toilet-seats-hd-7000-64_1000.jpg,BIO BIDET,https://www.homedepot.com/p/BIO-BIDET-HD-7000-Electric-Bidet-Seat-for-Elongated-Toilets-in-White-with-Fusion-Heating-Technology-HD-7000/309404961,239,239,"Make a bathroom upgrade with this HD-7000 electric bidet seat. Designed for elongated toilets, it features an oscillating nozzle, posterior wash and softer feminine wash. A heated seat and warm air dryer bring more cleanliness.",43%,Cost of Goods Sold,BIO BIDET HD-7000 Electric Bidet Seat for Elongated Toilets in White with Fusion Heating Technology
109,215583,https://images.thdstatic.com/productImages/6fe20a93-2ab3-453c-b589-a96123a18b20/svn/white-glacier-bay-two-piece-toilets-n2316-64_1000.jpg,Glacier Bay,https://www.homedepot.com/p/Glacier-Bay-12-inch-Rough-In-Two-Piece-1-1-GPF-1-6-GPF-Dual-Flush-Elongated-Toilet-in-White-Seat-Included-N2316/100676582,109,109,"The Glacier Bay 2-Piece High-Efficiency Dual-Flush Complete Elongated Toilet in White delivers powerful 1.1 or 1.6 GPF performance and features a WaterSense certified design to help conserve water. This toilet's vitreous china construction offers resistance to acid, abrasion and staining. The all-in-one product contains the toilet bowl, tank and seat along with a wax ring and floor bolts with caps. It's backed by a limited lifetime warranty.",43%,Cost of Goods Sold,Glacier Bay 12 inch Rough In Two-Piece 1.1 GPF/1.6 GPF Dual Flush Elongated Toilet in White Seat Included
169,1011059355,https://images.thdstatic.com/productImages/a7235111-ada8-435e-8375-7ed3b513631a/svn/white-american-standard-two-piece-toilets-788aa104-020-64_1000.jpg,American Standard,https://www.homedepot.com/p/American-Standard-Cadet-12-in-Antimicrobial-2-Piece-1-28-GPF-Single-Flush-Chair-Height-Elongated-Toilet-with-Slow-Close-Seat-in-White-788AA104-020/329008699,169,169,"The cadet chair height elongated toilet from American Standard is a high-efficiency, ultra-low consumption toilet that uses 20% less water than conventional toilets without sacrificing performance. Combining power and convenience, the cadet stands at a comfortable height for ease of use. Features exclusive ever clean antimicrobial surface on the toilet and seat, and power wash rim for a longer-lasting clean.",43%,Cost of Goods Sold,American Standard Cadet 12 in. Antimicrobial 2-Piece 1.28 GPF Single Flush Chair Height Elongated Toilet with Slow Close Seat in White
109,686826,https://images.thdstatic.com/productImages/63de0c84-6294-400e-94c2-2bdb10fc9a74/svn/white-glacier-bay-two-piece-toilets-n2428e-64_1000.jpg,Glacier Bay,https://www.homedepot.com/p/Glacier-Bay-12-inch-Rough-In-Two-Piece-1-28-GPF-Single-Flush-Elongated-Toilet-in-White-Seat-Included-N2428E/204074796,109,109,"Get high-performance with a beautifully designed all in one Glacier Bay 2-piece 1.28 GPF High-Efficiency Elongated Toilet in White. It has plenty of flush power and is easy to install with an all-in-one package that includes the tank, bowl, wax ring, seat, and floor mounting bolt . The vitreous china will resist stains, acid and abrasions to shine brightly for the life of the toilet. The elongated chair-height bowl gives maximum comfort and has a white porcelain finish that blends with any existing decor in your bathroom.",43%,Cost of Goods Sold,Glacier Bay 12 inch Rough In Two-Piece 1.28 GPF Single Flush Elongated Toilet in White Seat Included
229,1009217182,https://images.thdstatic.com/productImages/98b19cf1-96f6-4736-9c09-2f57c6315242/svn/white-bio-bidet-bidet-toilet-seats-hd-7500-64_1000.jpg,BIO BIDET,https://www.homedepot.com/p/BIO-BIDET-HD-7500-Electric-Bidet-Seat-for-Elongated-Toilets-in-White-HD-7500/323875139,229,229,"Upgrade your bathroom by installing this HD-7500 Electric Bidet Seat for Elongated Toilets in White. It features a self-cleaning stainless-steel nozzle, built-in air dryer and three wash options. The heated seat comes in handy on cold nights. Other unique features include the side panel and remote that allows you to easily select your desired settings.",43%,Cost of Goods Sold,BIO BIDET HD-7500 Electric Bidet Seat for Elongated Toilets in White
259,1008431426,https://images.thdstatic.com/productImages/b1e9146d-bd9d-4514-b29f-dd84f604db7c/svn/white-kohler-two-piece-toilets-33201-0-64_1000.jpg,KOHLER,https://www.homedepot.com/p/KOHLER-Elmbrook-12-in-Rough-In-2-Piece-1-28-GFP-Single-Flush-Elongated-Chair-Height-Toilet-in-White-with-Soft-Close-Seat-33201-0/322194703,259,259,"A perfect blend of traditional and contemporary design, the Elmbrook toilet complements a full range of bathroom styles. Beveled edges and simple lines enhance its distinctive profile. An innovative 1.28 gpf setting provides significant water savings without sacrificing performance. The toilet features Revolution 360 swirl flushing technology that keeps your bowl clean longer than a conventional flush, and the innovative AquaPiston technology offers a patented flush engine that delivers a fast, powerful, and virtually plug-free flush. This Complete Solution package comes with all the necessary installation parts and a Quiet-Close seat for added convenience.",43%,Cost of Goods Sold,KOHLER Elmbrook 12 in. Rough In 2-Piece 1.28 GFP Single Flush Elongated Chair Height Toilet in White with Soft Close Seat
249,1007747064,https://images.thdstatic.com/productImages/b2853f48-0c07-4dcc-abc4-dde744a0955b/svn/white-kohler-two-piece-toilets-78305-0-64_1000.jpg,KOHLER,https://www.homedepot.com/p/KOHLER-Highline-Arc-Extra-Tall-12-in-Rough-In-2-Piece-1-28-GFP-Single-Flush-Elongated-Toilet-in-White-with-Soft-Close-Seat-78305-0/320422533,249,249,"The Highline Arc Tall two-piece elongated toilet is KOHLER tallest toilet - a full 2-1/2 in. taller than Comfort Height toilets to provide you not only with enhanced comfort and added ease to sit and stand, but to also aid in maintaining easy accessibility. With its clean, simple design and elegant flared tank, this Highline water-conserving toilet combines both style and function. An innovative 1.28-gallon flush setting provides significant water savings of up to 16,500 gallons per year compared to older 3.5-gallon toilets without sacrificing flushing power, and The Complete Solution package includes everything necessary for installation.",43%,Cost of Goods Sold,KOHLER Highline Arc Extra Tall 12 in. Rough In 2-Piece 1.28 GFP Single Flush Elongated Toilet in White with Soft Close Seat
149,1011059354,https://images.thdstatic.com/productImages/9d300084-40ef-42bb-adaf-bfbabe12c98a/svn/white-american-standard-two-piece-toilets-788ba104-020-64_1000.jpg,American Standard,https://www.homedepot.com/p/American-Standard-Cadet-12-in-Antimicrobial-2-Piece-1-28-GPF-Single-Flush-Chair-Height-Round-Toilet-with-Slow-Close-Seat-in-White-788BA104-020/329008710,149,149,"The Cadet Chair Height Round Front Toilet from American Standard is a high-efficiency, ultra-low consumption toilet that uses 20% less water than conventional toilets without sacrificing performance. Combining power and convenience, the Cadet stands at a comfortable height for ease of use. Features exclusive EverClean antimicrobial surface on the toilet and seat, and PowerWash rim for a longer-lasting clean.",43%,Cost of Goods Sold,American Standard Cadet 12 in. Antimicrobial 2-Piece 1.28 GPF Single Flush Chair Height Round Toilet with Slow Close Seat in White
4249.85,1004548103,https://images.thdstatic.com/productImages/f7e9fdb4-a996-4ef8-8080-1d01bd65b9e3/svn/white-kohler-bidet-toilets-k-5401-pa-0-64_1000.jpg,KOHLER,https://www.homedepot.com/p/KOHLER-Veil-Comfort-Height-Intelligent-1-Piece-0-8-GPF-Dual-Flush-Elongated-Toilet-in-White-with-built-in-bidet-Seat-Included-K-5401-PA-0/309386177,4249.85,4249.85,"With its flowing and immaculately balanced curves, the Veil one-piece toilet with integrated cleansing functionality epitomizes minimalist and ergonomic design. Its sculpted core provides a suite of precision features finely tuned to offer optimum hygiene and ultimate individual comfort, from personal cleansing to an LED nightlight to hands-free opening and closing. All of the features are easy to control on a touchscreen LCD remote control.",43%,Cost of Goods Sold,"KOHLER Veil Comfort Height Intelligent 1-Piece 0.8 GPF Dual Flush Elongated Toilet in White with built in bidet, Seat Included"
249,1005143683,https://images.thdstatic.com/productImages/d43e5671-ee9b-4fc4-8ce7-9c3f60886767/svn/Champion-Tall-Height-Elongated-Toilet-in-Room_1000.jpg,American Standard,https://www.homedepot.com/p/American-Standard-Champion-Two-Piece-1-28-GPF-Single-Flush-Elongated-Chair-Height-Toilet-with-Slow-Close-Seat-in-White-747AA107SC-020/312442216,249,249,"To verify its power and unmatched performance, the Champion Right Height Toilet has been tested and proven by American Standard to flush a bucket of golf balls in a single flush, using 20% less water than conventional toilets. Newly updated with a clean, streamlined tank and cover to complement today's bathroom, this dependable, clog-free toilet comes with a slow-close seat featuring an extra-sturdy lid, enhanced for stability and flex-free comfort, plus a stylish trip lever for a decorative touch. To ensure longer-lasting cleanliness, the PowerWash rim cleans the bowl with every flush and the EverClean coating inhibits the growth of mold and mildew. Backed by an industry-leading warranty, the Champion toilet is unrivaled for power, performance, dependability and style, and is available exclusively at the Home Depot.",43%,Cost of Goods Sold,American Standard Champion Two-Piece 1.28 GPF Single Flush Elongated Chair Height Toilet with Slow-Close Seat in White
199,1003951329,https://images.thdstatic.com/productImages/3d37543e-894c-4fd1-9103-51262047a884/svn/white-kohler-two-piece-toilets-k-78253-0-64_1000.jpg,KOHLER,https://www.homedepot.com/p/KOHLER-Highline-Arc-12-in-Rough-In-2-Piece-1-28-GFP-Single-Flush-Round-Chair-Height-Toilet-in-White-with-Soft-Close-Seat-K-78253-0/307908573,199,199,"Trusted for years by professionals, Highline toilets are KOHLER bestselling toilet family. A brilliant blend of style and water efficiency, this Highline Arc toilet is distinguished by an elegant flared tank. Coupled with KOHLER powerful canister flush valve, there's no sacrificing performance for design. An innovative 1.28 Gal. flush setting provides significant water savings of up to 16,500 Gal. per year, compared to an old 3.5 Gal. toilet. This Complete Solution package includes everything necessary for installation and is available exclusively at The Home Depot.",43%,Cost of Goods Sold,KOHLER Highline Arc 12 in. Rough In 2-Piece 1.28 GFP Single Flush Round Chair Height Toilet in White with Soft Close Seat
149,1010139541,https://images.thdstatic.com/productImages/f1dbf65e-b444-467b-9a8e-a15acf072c6c/svn/white-glacier-bay-two-piece-toilets-n2450r-64_1000.jpg,Glacier Bay,https://www.homedepot.com/p/Glacier-Bay-Power-Flush-12-inch-Rough-In-Two-Piece-1-28-GPF-Single-Flush-Round-Toilet-in-White-Seat-Included-N2450R/326671990,149,149,"Replace your old toilet with the Power Flush 2-piece 1.28 GPF High-Efficiency Single Flush Round Toilet Featuring Niagara Stealth Technology in White. This toilet features patented hydraulic technology, known as the Stealth. One flush thoroughly evacuates the bowl every time and eliminates double flushing. This toilet has achieved a quiet, powerful and proven flush saving thousands of gallons with no change in consumer use or behavior. The flapper less design means no costly flapper, chains or levers to replace and no leaks ever. Also, this toilet virtually eliminates all refill noise as the fill valve is never exposed.",43%,Cost of Goods Sold,Glacier Bay Power Flush 12 inch Rough In Two-Piece 1.28 GPF Single Flush Round Toilet in White Seat Included
349,1007746890,https://images.thdstatic.com/productImages/c3d8fa41-41b1-431d-babf-4c437f3510bb/svn/white-kohler-one-piece-toilets-32901-0-64_1000.jpg,KOHLER,https://www.homedepot.com/p/KOHLER-Santa-Rosa-12-in-Rough-In-1-Piece-1-28-GFP-Single-Flush-Elongated-Chair-Height-Toilet-in-White-with-Soft-Close-Seat-32901-0/320020341,349,349,"The one-piece design of this Santa Rosa toilet adds a contemporary look to your powder room. Perfect for smaller bathrooms and powder rooms where space is at a premium, the compact elongated shape takes up the same space as a round-bowl toilet, yet its elongated shape adds added comfort. The 1.28-gallon high-efficiency flush provides water savings of up to 16,500 gallons per year versus an old 3.5-gallon toilet, without sacrificing performance. Revolution 360 swirl flushing technology keeps the bowl clean longer, and chair-height seating makes it more comfortable to use. A Quiet-Close seat is included.",43%,Cost of Goods Sold,KOHLER Santa Rosa 12 in. Rough In 1-Piece 1.28 GFP Single Flush Elongated Chair Height Toilet in White with Soft Close Seat
219,1011528241,https://images.thdstatic.com/productImages/c00f14f1-cfad-4114-967e-377fc8053ee5/svn/white-glacier-bay-two-piece-toilets-n2450e-19-64_1000.jpg,Glacier Bay,https://www.homedepot.com/p/Glacier-Bay-Power-Flush-2-Piece-1-28-GPF-Single-Flush-Extra-Tall-Elongated-Toilet-in-White-with-Slow-Close-Seat-Included-N2450E-19/330066873,219,219,"Replace your old toilet with the Power Flush Extra Tall 2-piece 1.28 GPF High-Efficiency Single Flush Elongated Toilet Featuring Niagara Stealth Technology and an extra tall 19 in. bowl. This toilet features patented hydraulic technology, known as the Stealth. One flush thoroughly evacuates the bowl every time and eliminates double flushing. This toilet has achieved a quiet, powerful and proven flush saving thousands of gallons with no change in consumer use or behavior. The flapper less design means no costly flapper, chains or levers to replace and no leaks ever. Also, this toilet virtually eliminates all refill noise as the fill valve is never exposed. The 19 in. extra tall elongated bowl is 2.5 in. taller than the standard chair height for added comfort on your knees.",43%,Cost of Goods Sold,Glacier Bay Power Flush 2-Piece 1.28 GPF Single Flush Extra Tall Elongated Toilet in White with Slow-Close Seat Included
269,1005536234,https://images.thdstatic.com/productImages/98154a8d-5ab1-4d80-9122-fd4f935c1786/svn/white-kohler-two-piece-toilets-k-31648-0-64_1000.jpg,KOHLER,https://www.homedepot.com/p/KOHLER-Cimarron-12-in-Rough-In-2-Piece-1-28-GFP-Single-Flush-Elongated-Toilet-in-White-with-Soft-Close-Seat-K-31648-0/313789704,269,269,"The Cimarron Comfort Height toilet has become an enduring symbol of power and timeless beauty. Trusted for years by professionals and homeowners, Cimarron features KOHLER's most complete flush ever, Revolution 360 degree swirl flush powered by the AquaPiston flush valve. Revolution 360 degree swirl flushing technology keeps your bowl cleaner longer than a conventional flush. Installation saves you time and money, too, with KOHLER's patent-pending two-bolt tank-to-bowl omni-directional leveling system.",43%,Cost of Goods Sold,KOHLER Cimarron 12 in. Rough In 2-Piece 1.28 GFP Single Flush Elongated Toilet in White with Soft Close Seat
99,340995,https://images.thdstatic.com/productImages/68ff5e6e-ccb3-4b2f-9f2c-dccea428e622/svn/white-glacier-bay-two-piece-toilets-n2428rb-n2428t-64_1000.jpg,Glacier Bay,https://www.homedepot.com/p/Glacier-Bay-12-inch-Rough-In-Two-Piece-1-28-GPF-Single-Flush-Round-Toilet-in-White-Seat-Included-N2428RB-N2428T/202634188,99,99,"Made from a durable and vitreous china, the Glacier Bay 2-Piece High Efficiency Round Toilet in White is stain, acid and abrasion resistant. The two piece toilet has a separate bowl and tank. It delivers superior flush performance.",43%,Cost of Goods Sold,Glacier Bay 12 inch Rough In Two-Piece 1.28 GPF Single Flush Round Toilet in White Seat Included
438.51,1006746772,https://images.thdstatic.com/productImages/57b32ad3-276e-43a0-81e2-bd9fb5fe1e1d/svn/cotton-white-toto-two-piece-toilets-ms776124csfg-01-64_1000.jpg,TOTO,https://www.homedepot.com/p/TOTO-Drake-12-in-Rough-In-Two-Piece-1-6-GPF-Single-Flush-Elongated-Toilet-in-Cotton-White-SoftClose-Seat-Included-MS776124CSFG-01/317577233,438.51,438.51,"TOTO Drake 2-Piece Elongated 1.6 GPF Universal Height Toilet with and SoftClose Seat, is a beautifully designed high profile toilet. Featuring TOTO's , a rimless, hole-free design with dual-nozzles that creates a centrifugal washing action that assists in rinsing the bowl more efficiently. This version of the TOTO Drake includes , a layer of exceptionally smooth glaze that minimizes waste from sticking to the ceramic. coupled with, assists to reduce the frequency of toilet cleanings, minimizing the usage of water, harsh chemicals, and time required for cleaning. This version of the TOTO Drake is designed in TOTO's Universal Height, which allows for a more comfortable seat position across a wide range of users. This version of the Drake has a left-hand chrome trip lever, is ADA compliant, and meets the standards for EPA WaterSense, and California's CEC and CALGreen requirements. The Drake 2-piece toilet includes a tank to bowl gasket, tank to bowl hardware, toilet bolt caps and SoftClose toilet seat. Additional items needed for installation and use must be purchased separately: wax ring, toilet mounting bolts and water supply lines.",43%,Cost of Goods Sold,"TOTO Drake 12 in. Rough In Two-Piece 1.6 GPF Single Flush Elongated Toilet in Cotton White, SoftClose Seat Included"
179,1008983028,https://images.thdstatic.com/productImages/9b62a7a5-3d90-4a9d-b419-326bd41ecbe0/svn/white-american-standard-two-piece-toilets-719aa101-020-64_1000.jpg,American Standard,https://www.homedepot.com/p/American-Standard-Rumson-2-Piece-1-28-GPF-Single-Flush-Elongated-Toilet-in-White-Seat-is-Included-719AA101-020/323484855,179,179,"Rumson toilet from American Standard combines classic design and high performance for today's home. Engineered for industry-leading flush performance with the highest MaP score of 1,000 grams, the Rumson delivers the power to clear the bowl in a single flush. The PowerWash rim scrubs the bowl, keeping it fresher, longer while EverClean antimicrobial additive inhibits the growth of stain and odor causing bacteria, mold and mildew on the surface. The tall, elongated, 12 in. rough configuration includes a durable, slow-close seat.",43%,Cost of Goods Sold,American Standard Rumson 2-Piece 1.28 GPF Single Flush Elongated Toilet in White Seat is Included
