Purchase Price,SKU,Image,Manufacturer,URL,Sale Price,Price,Description,Markup,Item Type,Item Name
264,537484,https://images.thdstatic.com/productImages/b2e540a7-0f3b-4eac-b64b-f9fe95e00fa2/svn/white-american-standard-two-piece-toilets-715aa-001-020-64_1000.jpg,American Standard,https://www.homedepot.com/p/American-Standard-Cadet-3-Decor-Tall-Height-2-Piece-1-28-GPF-Single-Flush-Elongated-Toilet-with-Seat-in-White-Seat-Included-715AA-001-020/203027677,264,264,"The Cadet 3 Decor Skirted Right Height Elongated Toilet from American Standard features a sleek, concealed trapway that obscures the traditional curves and crevices for easier cleaning. This contemporary design, with telescoping lid that conceals the seat, presents a clean, seamless look in today's bathroom. Comfortable, elongated chair height bowl ensures effortless sitting and standing. The Cadet 3 Decor is a high-efficiency, ultra-low consumption toilet that uses 20% less water than conventional toilets without sacrificing performance.",43%,Cost of Goods Sold,"American Standard Cadet 3 Decor Tall Height 2-Piece 1.28 GPF Single Flush Elongated Toilet with Seat in White, Seat Included"
759,1008704188,https://images.thdstatic.com/productImages/b1765a56-1fa2-4ef9-bd4a-a7a76c633caf/svn/white-woodbridge-bidet-toilets-ht0070-64_1000.jpg,WOODBRIDGE,https://www.homedepot.com/p/WOODBRIDGE-Intelligent-1-28-GPF-Elongated-Smart-Bidet-Toilet-in-White-with-Foot-Sensor-Function-Auto-Open-and-Auto-Close-HT0070/322978376,759,759,"WOODBRIDGE B0990S One Piece Elongated Smart Toilet Bidet Auto Open and Close Seat and Lid, Auto Flush, Heated Seat and Integrated Multi Function Remote Control, White. Quality construction with elegant craftsmanship to offer the best in contemporary styling and functionality. One-Piece construction, sleek look, and compliment with modern, transitional, and traditional theme.",43%,Cost of Goods Sold,"WOODBRIDGE Intelligent 1.28 GPF Elongated Smart Bidet Toilet in White with Foot Sensor Function, Auto Open and Auto Close"
179,1011648736,https://images.thdstatic.com/productImages/da5e0e81-9787-4b7d-bb01-8fc43183e007/svn/white-glacier-bay-two-piece-toilets-n2428r-10-64_1000.jpg,Glacier Bay,https://www.homedepot.com/p/Glacier-Bay-10-in-Rough-in-2-Piece-1-28-GPF-Single-Flush-Round-Front-Toilet-in-White-Seat-Included-N2428R-10/330316133,179,179,"The Glacier Bay 10 in. rough-in 2-piece 1.28 GPF high-efficiency round front toilet in white is manufactured from durable vitreous China which is resistant to stains, acid and abrasions for long-lasting beauty. This 2-piece toilet comes with a chair-height bowl for maximum comfort and has a white porcelain finish that blends with a wide range of bath or powder room decor styles. High-performance with plenty of flush power, this 2-piece toilet is easy to install and includes a toilet seat, wax ring and floor mounting bolt seat. Limited lifetime warranty.",43%,Cost of Goods Sold,"Glacier Bay 10 in. Rough in. 2-Piece 1.28 GPF Single Flush Round Front Toilet in White, Seat Included"
309,1000052403,https://images.thdstatic.com/productImages/c48b2c0d-6041-4bd6-a2ed-7f9c22552308/svn/white-american-standard-two-piece-toilets-707aa101-020-64_1000.jpg,American Standard,https://www.homedepot.com/p/American-Standard-Optum-VorMax-Two-Piece-1-28-GPF-Single-Flush-Elongated-Chair-Height-Toilet-with-Slow-Close-Seat-in-White-707AA101-020/205195423,309,309,"VorMax flushing technology is the solution to maintaining a cleaner toilet bowl by simply flushing the toilet. Its revolutionary VorMax flushing system completely cleans the entire bowl, including under the rim. The VorMax flushing technology has been independently tested and proven to CLEAN 2X BETTER than conventional toilets. This helps maintain a tidier toilet bowl longer, so cleaning is a breeze. Source: Test witnessed by IAPMO R&T Labs comparing VorMax against conventional under-the-rim-water-dispersal toilets from major retailers.",43%,Cost of Goods Sold,American Standard Optum VorMax Two-Piece 1.28 GPF Single Flush Elongated Chair Height Toilet with Slow-Close Seat in White
19.98,546077,https://images.thdstatic.com/productImages/9ec73536-6fb6-421f-88f8-adb4d0007304/svn/white-glacier-bay-toilet-seats-31450-000-64_1000.jpg,Glacier Bay,https://www.homedepot.com/p/Glacier-Bay-Elongated-Enameled-Wood-Closed-Front-Toilet-Seat-in-White-Removes-for-Easy-Cleaning-31450-000/204393412,19.98,19.98,This Glacier Bay Elongated Closed Front Toilet Seat is made with enameled wood with a basic design. The seat features a lift-off hinge that allows it to be removed for easy cleaning. Made with Earth-friendly materials and processes.,43%,Cost of Goods Sold,Glacier Bay Elongated Enameled Wood Closed Front Toilet Seat in White Removes for Easy Cleaning
9.98,1001220854,https://images.thdstatic.com/productImages/7339934d-23e5-4c45-8aa2-fc5dadb94415/svn/fluidmaster-toilet-wax-rings-7530p24-64_1000.jpg,Fluidmaster,https://www.homedepot.com/p/Fluidmaster-Better-Than-Wax-Universal-Wax-Free-Toilet-Seal-7530P24/205762183,9.98,9.98,"The Fluidmaster 7530P24 Better Than Wax, Wax Free Toilet Seal is a modern day solution to an old toilet problem, wax seals. Remove the hassle out of replacing your toilets wax seal with Fluidmaster Better Than Wax. This superior solution eliminates messy wax, and cuts down on repair time, with a rubber toilet seal design. A truly universal toilet repair part that fits any toilet, drain, or flange. The unique design eliminates the worry of setting the toilet in the wrong position, simply pick up and reposition. The Better Than Wax replacement toilet seal works above the ground, even with the ground, below the ground, or on uneven surfaces for a worry free replacement. Built to last this durable design offers no rust brass bolts and hardware, along with a 10 year warranty. Fluidmaster Better Than Wax Seal, no mess and no leaks.",43%,Cost of Goods Sold,Fluidmaster Better Than Wax Universal Wax-Free Toilet Seal
337,1008978595,https://images.thdstatic.com/productImages/f54976e3-0c49-5de3-a090-90630c08d515/svn/white-kohler-one-piece-toilets-30810-0-64_1000.jpg,KOHLER,https://www.homedepot.com/p/KOHLER-Santa-Rosa-12-in-Rough-In-1-Piece-1-28-GPF-Single-Flush-Elongated-Chair-Height-Toilet-in-White-with-Soft-Close-Seat-30810-0/323288626,337,337,"The one-piece design of this Santa Rosa toilet adds a contemporary look to your powder room. Perfect for smaller bathrooms and powder rooms where space is at a premium, the compact elongated shape takes up the same space as a round-bowl toilet, yet its elongated shape adds added comfort. Its 1.28-gallon high-efficiency flush provides water savings of up to 16,500 gallons per year versus an old 3.5-gallon toilet, without sacrificing performance. Revolution 360 swirl flushing technology keeps the bowl clean longer, and the chair-height compact elongated bowl makes it comfortable to use. A Quiet-Close seat is included.",43%,Cost of Goods Sold,KOHLER Santa Rosa 12 in. Rough In 1-Piece 1.28 GPF Single Flush Elongated Chair Height Toilet in White with Soft Close Seat
467.25,1002150267,https://images.thdstatic.com/productImages/5c770444-42f3-4590-87a1-6dc1b6b4c979/svn/cotton-white-toto-one-piece-toilets-ms853113e-01-64_1000.jpg,TOTO,https://www.homedepot.com/p/TOTO-Eco-UltraMax-12-in-Rough-In-One-Piece-1-28-GPF-Single-Flush-Round-Toilet-in-Cotton-White-SoftClose-Seat-Included-MS853113E-01/300515264,467.25,467.25,"The TOTO Eco UltraMax One-Piece Round Bowl 1.28 GPF Toilet projects TOTO's mark of excellence: ""People Planet Water."" The TOTO Eco UltraMax features a sleek, one-piece design that will immediately beautify the appearance of your bathroom. The one-piece design will immediately beautify the appearance of your bathroom. The one-piece design is not only aesthetically pleasing, but also offers the benefit of being easier to clean versus a two-piece toilet. By removing the gap between the tank and bowl, we eliminate the hiding place for dirt and debris. An additional benefit of the one-piece toilet is that there is no threat of leaks from bolts or gaskets that can occur in two-piece toilets. The TOTO Eco UltraMax utilizes TOTO's E-Max flushing system. The E-Max flushing system features a 3"" wide flush valve, extra-large siphon jet, and a large trapway. This reliable, highly efficient combination generates a powerful cleansing flush while only using 1.28 gallons of water. The TOTO Eco UltraMax 1.28 GPF meets the standards for EPA WaterSense, and California's CEC and CALGreen requirements. The TOTO Eco UltraMax has a left-hand chrome trip lever and has an included TOTO SoftClose seat.",43%,Cost of Goods Sold,"TOTO Eco UltraMax 12 in. Rough In One-Piece 1.28 GPF Single Flush Round Toilet in Cotton White, SoftClose Seat Included"
999,1012626865,https://images.thdstatic.com/productImages/14abadf7-46d9-4b74-b5de-7a2fb72226dd/svn/white-horow-bidet-toilets-hr-t38-64_1000.jpg,HOROW,https://www.homedepot.com/p/HOROW-Elegant-Luxury-Elongated-Smart-Bidet-Toilet-in-White-w-Surprise-Ambient-Light-Build-in-Tank-Auto-Open-Close-UV-Light-HR-T38/331933087,999,999,"Modern Collect Artwork HOROW T38 Smart Bidet ToiletThe biggest highlight of T38, and the most unique and outstanding feature that surpasses other smart toilets on the market, is that it is full of surprises and exudes warm and happy atmosphere lights. People always like to install colorful light strips in various places, such as on TV walls, near bedside tables, and in cars. Such exciting light strips can be seen everywhere, so we installed this happy and exciting atmosphere light into the toilet, a happy belonging for people.Let the boring toilet change its atmosphere instantly and love life in ordinary days.",43%,Cost of Goods Sold,"HOROW Elegant Luxury Elongated Smart Bidet Toilet in White w/Surprise Ambient Light, Build-in Tank, Auto Open/Close, UV Light"
39.98,1002817105,https://images.thdstatic.com/productImages/aaa1c08a-2f51-4b82-8c53-20509105642c/svn/white-kohler-toilet-seats-k-20466-0-64_1000.jpg,KOHLER,https://www.homedepot.com/p/KOHLER-Stonewood-Elongated-Front-Toilet-Seat-in-White-K-20466-0/303317056,39.98,39.98,"This Stonewood toilet seat offers a versatile design that complements many bathroom styles. Compatible with most elongated 1 or 2 piece toilets, the compression-molded wood seat provides a substantial look and feel. This seat features innovative technology that makes it easy to install and clean.",43%,Cost of Goods Sold,KOHLER Stonewood Elongated Front Toilet Seat in White
868,1010678809,https://images.thdstatic.com/productImages/6442de50-e98b-4ec8-9ab6-a31e350cd0a3/svn/white-sterling-tub-shower-combos-71171710-0-t-64_1000.jpg,Sterling,https://www.homedepot.com/p/Sterling-Traverse-60-in-L-x-30-in-W-x-60-in-H-Left-Hand-Drain-Rectangular-Tub-Shower-Combo-Unit-in-White-71171710-0-T/328295820,868,868,"Update your bathing routine with the traverse subway tile wall set and tub combo. Featuring contemporary subway tile design with a sleek shelf, it has ample storage space for your shampoo bottles. Built of solid vikrell for material strength, durability, and lasting beauty, it features a durable, smooth, high gloss finish that easy to clean. Tongue-and-groove modular design allows for easy installation during any phase of construction. The innovative dry-block seal and channeled water containment system forms watertight seams.",43%,Cost of Goods Sold,Sterling Traverse 60 in. L x 30 in. W x 60 in. H Left-Hand Drain Rectangular Tub Shower Combo Unit in White
